{
  "schema_version": "1.0.0",
  "snapshot_date": "2026-04-09",
  "group_slug": "venuiti",
  "target_names": [
    "Venuiti Solutions Inc.",
    "DevStaff Canada",
    "Venuiti Healthcare",
    "Venuiti Group of Companies"
  ],
  "canonical_group": {
    "entity_id": "group_venuiti",
    "name": "Venuiti Group of Companies",
    "entity_kind": "umbrella_group",
    "validation_status": "validated_public_group_name",
    "confidence": 0.87,
    "summary": "Multiple official pages use 'Venuiti Group of Companies' as the umbrella label for related operating brands. Current evidence supports a public-facing umbrella name, not a verified legal holding-company conclusion.",
    "evidence_source_ids": [
      "devstaff_meet_thomas",
      "venuiti_health_staffing"
    ]
  },
  "validation_logic": {
    "signal_weights": {
      "direct_domain_match": 0.28,
      "official_domain_cross_reference": 0.22,
      "explicit_group_language": 0.2,
      "shared_location": 0.12,
      "shared_employee_overlap": 0.1,
      "shared_founding_year": 0.08
    },
    "acceptance_rules": [
      "Accept a relationship as high confidence at 0.80 or above when supported by at least one official-source signal or multiple corroborating signals.",
      "Accept with caution at 0.60 to 0.79 when the evidence set is strong but lacks direct legal-ownership proof.",
      "Keep 0.45 to 0.59 as candidate-only and require more evidence before operational use in ownership-sensitive workflows."
    ],
    "rejection_rules": [
      "Reject matches below 0.45 as weak or unrelated.",
      "Do not infer legal ownership, control, or reporting lines from shared location, shared people, or shared founding year alone.",
      "Treat LinkedIn company metadata as supporting evidence rather than primary legal proof."
    ]
  },
  "companies": [
    {
      "entity_id": "company_devstaff_canada",
      "display_name": "DevStaff Canada",
      "entity_kind": "company",
      "status": "active",
      "classification": {
        "canonical_umbrella_name": "Venuiti Group of Companies",
        "legal_style_names": [],
        "public_facing_brands": [
          "DevStaff Canada",
          "DevStaff"
        ],
        "service_lines": [
          "Technical staffing",
          "Tech recruiting",
          "IT staffing",
          "Healthcare staffing",
          "Temporary staffing",
          "Permanent staffing",
          "Full cycle recruitment"
        ]
      },
      "profile": {
        "website": "https://devstaff.ca",
        "industry": "Staffing and Recruiting",
        "founded_year": 2010,
        "headquarters": {
          "city": "Kitchener",
          "region": "Ontario",
          "country": "Canada"
        },
        "known_locations": [
          {
            "label": "Main office cited on contact page",
            "address": "283 Duke St W, Kitchener, ON N2H 3X7, Canada",
            "source_id": "devstaff_contact"
          },
          {
            "label": "LinkedIn headquarters",
            "address": "Kitchener, Ontario, Canada",
            "source_id": "devstaff_linkedin"
          }
        ],
        "company_size_range": "51-200 employees",
        "ownership_language": "LinkedIn lists Public Company; official site does not independently confirm this legal classification.",
        "business_description": "Boutique technical staffing agency focused on developer and health-tech recruiting."
      },
      "source_ids": [
        "devstaff_contact",
        "devstaff_linkedin",
        "devstaff_meet_thomas",
        "venuiti_health_staffing"
      ],
      "interview_signals": [
        "Staffing narrative is closely connected to internal technology roots rather than generic recruiting.",
        "Official pages repeatedly position DevStaff as a health-tech staffing partner.",
        "Recent public posts reference hiring for roles at Venuiti, indicating operational alignment with the broader group."
      ],
      "risk_flags": [
        "No independent registry source was captured for the exact legal entity name in this run, so the legal-style name remains unresolved.",
        "LinkedIn's 'Public Company' label conflicts with the absence of equivalent language on official pages and should not be treated as ownership proof."
      ]
    },
    {
      "entity_id": "company_venuiti_healthcare",
      "display_name": "Venuiti Healthcare",
      "entity_kind": "company",
      "status": "active",
      "classification": {
        "canonical_umbrella_name": "Venuiti Group of Companies",
        "legal_style_names": [
          "Venuiti Healthcare Inc."
        ],
        "public_facing_brands": [
          "Venuiti Healthcare",
          "Venuiti Health"
        ],
        "service_lines": [
          "Healthcare software development",
          "Interoperability",
          "Conformance tooling",
          "Testing",
          "Health-tech staffing",
          "Strategic consulting"
        ]
      },
      "profile": {
        "website": "https://venuitihealth.com",
        "industry": "Software Development",
        "founded_year": 2001,
        "headquarters": {
          "city": "Waterloo",
          "region": "Ontario",
          "country": "Canada"
        },
        "known_locations": [
          {
            "label": "Primary location",
            "address": "33 Dupont St E, Waterloo, ON N2J 2G8, Canada",
            "source_id": "venuiti_health_linkedin"
          },
          {
            "label": "Additional operating geography",
            "address": "Atlanta, Georgia, United States",
            "source_id": "venuiti_health_contact"
          }
        ],
        "company_size_range": "11-50 employees",
        "ownership_language": "Privately Held",
        "business_description": "Healthcare-focused software and interoperability delivery brand with strong emphasis on FHIR, compliance, security, and custom health-tech implementation."
      },
      "source_ids": [
        "venuiti_health_contact",
        "venuiti_health_services",
        "venuiti_health_staffing",
        "venuiti_health_linkedin"
      ],
      "interview_signals": [
        "Healthcare specialization is deep, not incidental: interoperability, conformance, testing, and consulting appear repeatedly.",
        "Messaging emphasizes long-term client relationships, private ownership, and healthcare-specific compliance literacy.",
        "Cross-brand staffing integration with DevStaff is explicit on official pages."
      ],
      "risk_flags": [
        "The legal-style name 'Venuiti Healthcare Inc.' is evidenced by page copyright language, which is useful but not equal to a registry filing.",
        "Relationship to Venuiti Solutions is supported by strong overlap signals and group references, but direct ownership structure is still not independently verified."
      ]
    },
    {
      "entity_id": "company_venuiti_solutions",
      "display_name": "Venuiti Solutions Inc.",
      "entity_kind": "company",
      "status": "active",
      "classification": {
        "canonical_umbrella_name": "Venuiti Group of Companies",
        "legal_style_names": [
          "Venuiti Solutions Inc."
        ],
        "public_facing_brands": [
          "Venuiti",
          "Venuiti Solutions"
        ],
        "service_lines": [
          "Custom software development",
          "Digital marketing",
          "UX/UI",
          "Production",
          "Media planning and engagement"
        ]
      },
      "profile": {
        "website": "https://www.venuiti.com",
        "industry": "Software Development",
        "founded_year": 2001,
        "headquarters": {
          "city": "Waterloo",
          "region": "Ontario",
          "country": "Canada"
        },
        "known_locations": [
          {
            "label": "Primary location cited on LinkedIn",
            "address": "33 Dupont St E, Waterloo, ON N2J 2G8, Canada",
            "source_id": "venuiti_solutions_linkedin"
          },
          {
            "label": "Postal/contact address on privacy policy",
            "address": "283 Duke St. W., Suite 214, Kitchener, ON N2H 3X7, Canada",
            "source_id": "venuiti_solutions_privacy"
          }
        ],
        "company_size_range": "11-50 employees",
        "ownership_language": "Privately Held",
        "business_description": "Software development and digital marketing firm describing itself as a team combining storytelling, strategy, and technical delivery."
      },
      "source_ids": [
        "venuiti_solutions_privacy",
        "venuiti_solutions_linkedin",
        "venuiti_why_canada"
      ],
      "interview_signals": [
        "Founder-led and long-running business dating to 2001.",
        "Maintains both technology delivery and marketing-oriented capabilities.",
        "Strong Kitchener-Waterloo presence with U.S.-facing positioning."
      ],
      "risk_flags": [
        "Official website evidence confirms the name and contact address, but detailed corporate registry data was not independently verified in this run.",
        "LinkedIn supplies founding year, Waterloo headquarters, and overlapping employee data; treat those fields as supporting evidence rather than primary legal proof."
      ]
    }
  ],
  "group_relationships": [
    {
      "relationship_id": "rel_group_to_devstaff",
      "from_entity_id": "group_venuiti",
      "to_entity_id": "company_devstaff_canada",
      "relationship_type": "umbrella_member",
      "confidence": 0.574,
      "decision": "candidate_only",
      "evidence_source_ids": [
        "devstaff_contact",
        "devstaff_linkedin",
        "devstaff_meet_thomas",
        "venuiti_health_staffing",
        "venuiti_solutions_linkedin",
        "venuiti_solutions_privacy"
      ],
      "signals": [
        {
          "signal": "official_domain_cross_reference",
          "strength": 1.0,
          "weight": 0.22,
          "weighted_score": 0.22,